status|title|company|location|date|blurb|tags|link|id|provider|querynew|UiPath Consultant--Full Time -- Irvine, California|Speridian Technologies, LLC|Irvine, CA|2020-07-31|UiPath ConsultantIrvine, CADuration: Full TimeThe UiPath Consultant will be part of the RPA team, responsible for translating the functional requirements into the architecture for the solution. The responsibilities will involve selecting the most appropriate techniques and options based on the requirements. The architect will also ensure the solution architecture aligns with enterprise architecture and adheres to enterprise architecture principles. The architect will also be responsible for overall successful execution of the projects and customer satisfaction within RPA practice of Speridian. The architect will work closely with sales, presales and other technical team to ensure full support to the sales team during the deal pursuits.ResponsibilitiesDesigning and architecting the UiPath product/solutionEnsuring the product/solution architecture & existing ongoing Application Architecture is scalable and extensibleDriving the adoption of best practices around coding, design, quality, and performanceConstantly upgrading the product with evolving technology and customer requirementsLeading in design, specification, and selection of IT solutions, giving due consideration to functionality, data, security, integration, infrastructure, and performanceSupporting the development team in developing solutionsEstimating costs and preparing business cases for IT solutions, giving due consideration to infrastructure, licensing, development, and supportWorking with the project team to develop high level project schedule and resource allocation for implementationExperience End-to-End development of Business Process using Robotic Process Automation.Problem-solving issues that arise in day to day running of UI-Path processes and providing timely responses and solutions as required.End to end process automation using UiPath. Experienced in staging and deploying the automation solution into test and Live environments.Worked with the Business Analysts in identifying and defining the requirementsExperienced in handling unstructured data using Regular expressions, Computer vision and basic knowledge of PythonQualifications:5+ years of experience with UiPath3+ years of experience with Agile and Scrum methodologiesTechnical background in application developmentExperience in consulting and client-facing rolesPossess fantastic interpersonal skills, excellent verbal and written communicationsHighly organized and have experience directing othersNice to have skills:Knowledge of latest technologies, cloud platforms, AI/ML, CI/CD and IoTBackground in Microsoft TechnologiesExperience with other RPA tools like Blue Prism, Automation Anywhere||https://job-openings.monster.com/uipath-consultant-full-time-irvine-california-irvine-ca-us-speridian-technologies-llc/219072125|219072125|monster|Python
new|Digital Senior Software Engineer|Beacon Hill Staffing Group, LLC|Los Angeles Metro Area, CA|2020-08-14|"Position: Digital Senior Software Engineer Hours: 8-5 / 40 hrPosition will be remote. The candidate must be willing to work in the PST timezone. There is potential for temp to perm.     As a member of the Digital Technologies Group, the Senior Software Engineer is responsible for designing, developing and maintaining legacy and ""Cloud First"" applications written primarily in C# and focused on .Net Core and Azure cloud platform. The group is continuously working to improve our Agile, Engineering, and DevOps practices and this role will be expected to actively participate in these efforts. At its core, this role requires excellent problem solving skills and C#/.Net coding capability. Candidate will need to effectively communicate, collaborate, and influence engineering and business team members across many projects and departmental boundaries. Additionally, candidate should not be afraid to get their hands dirty working incident responses, writing code, configuring applications, troubleshooting issues, digging into logs, looking at metrics, etc. Candidate will be a key member of successful independent teams that solve problems in an efficient and timely manner.  Provides programming expertise and business analysis skills within an assigned business area, usually as a member of a project team, in analyzing, designing, modifying, and developing business applications. Prepares programming specifications from which programs will be written, and designs, codes, tests, debugs, and documents programs. Prepares programming documentation and recommends changes in development, maintenance and application standards. Analyzes and develops logical database designs, data models and relational data definitions across multiple computing environments (e.g., host based, distributed systems, client server, etc.) Complies with architectural standards and established methodologies and practices. Skills:  Requires a minimum of 7 years' experience in business application design and development. Solid teamwork and interpersonal skills; ability to work well on cross-functional project teams. At this level the main challenge is to identify causes and implement solutions to business problems in a multifunctional project, assessing and communicating issues of technology impact on the business.  Evaluates application software packages and makes recommendations to management. Participates with other colleagues in new product reviews, tests, and pilots. Collects and analyzes business requirements for large projects. Performs feasibility studies, translates requirements into an appropriate design. Identifies conflicting business practices and integration issues, suggests alternative solutions.   - Expert level hands-on full-stack development expertise in two or more of the following programming languages: C# (Required), Java (a plus), JavaScript, Go, Python - Strong domain expertise in cloud application development (Azure Preferred)-  IaaS, PaaS, Serverless, API Management - Web application server technologies - Monitoring Technologies (native cloud monitoring and 3rd party monitoring tools such as Dynatrace, Moogsoft, Splunk, and others) - Experience with Middleware, Web Servers, Proxies, Firewalls-  Expertise with databases and data modeling / design (SQL & NoSQL) - Extensive experience in creating engineering and architecture related documentation and other artifacts in support of large scale development efforts - Cloud and distributed application design, software architecture and practices - Hands-on expertise implementing and using DevOps and CICD techniques and technologies -  Experience using integrated development environments targeting Linux, Windows, public clouds required - Breadth of technical experience, and technical aptitude to learn and adjust to new technologies and cloud trends required - Familiarity with other SaaS Cloud solutions (e.g. Salesforce, Office 365) -  Security principles - encryption, authentication, authorization, integrity, auditing, pen testing etc. - and how these are applied in a cloud environment Requirements: Minimum 7 years' experience as a business or data/programmer analyst required. Minimum 7 years' experience with industry standard tools and languages (i.e. Visual Studio, Power BI, C#, ASP.NET, Web Services, Cloud Development, etc.) required.Find Us on Facebook!Follow Us on Twitter!Beacon Hill is an Equal Opportunity Employer that values the strength diversity brings to the workplace. Individuals with Disabilities and Protected Veterans are encouraged to apply.Company Profile:Beacon Hill Technologies, a premier National Information Technology Staffing Group, provides world class technology talent across all industries on a contract, direct (permanent), contract-to-direct and project basis.  Beacon Hill Technologies' dedicated team of recruiting and staffing experts consistently delivers quality IT professionals to solve our customers' technical and business needs. Beacon Hill Technologies covers a broad spectrum of IT positions, including Project Management and Business Analysis, Programming/Development, Database, Infrastructure, Quality Assurance, Production/Support and ERP roles.Learn more about Beacon Hill Staffing Group and our specialty divisions, Beacon Hill Associates, Beacon Hill Financial, Beacon Hill HR, Beacon Hill Legal, Beacon Hill Life Sciences and Beacon Hill Technologies by visiting www.beaconhillstaffing.com. We look forward to working with you.Beacon Hill. Employing the Future"||https://job-openings.monster.com/digital-senior-software-engineer-los-angeles-metro-area-ca-us-beacon-hill-staffing-group-llc/219524449|219524449|monster|Python
new|DevOps Engineer|Onebridge|Los Angeles, CA|2020-08-14|Onebridge is actively seeking a DevOps Engineer for a full-time remote role based out of LA.Overview:Skilled in automating systems and looking to take ownership of a new environment? This DevOps Engineer will collaborate with a team to design, implement, and support continuous delivery and automated workflow for application systems. You will join a company that is investing in modernization and prides itself on a collaborative and innovative team.Primary DutiesBuild, deploy, configure and maintain application systems using automationParticipate with the development and infrastructure teams from architecture design up to deploymentCoach and mentor development teams in DevOps processes and automation toolsEvaluate and recommend new technologies that will benefit the teamPerform scheduled maintenance and deployment activities off-hoursProvide 24x7 support for critical production issuesRequirementsBachelors degree in Computer Science or related field3+ years of DevOps engineering or software engineeringFluent with DevOps tools and practices which drive the Infrastructure as Code mindsetAWS Administration is a huge plus. Some development with Lambdas highly preferred.Knowledge of Jenkins preferredBASH, Python,PowerShell very helpfulKnowledge of containerization and source control tools is beneficialOnebridge offers competitive compensation and access to a comprehensive program which includes: Medical, Dental, Vision, Flexible PTO, Holiday Pay, and 401K.||https://job-openings.monster.com/devops-engineer-los-angeles-ca-us-onebridge/219254624|219254624|monster|Python
new|Platform Publisher  -  Music|Walkwaters Technologies|Culver City, CA|2020-08-10|Job Title: Platform Publisher Job Summary: We're looking for a Platform Publisher to program, QA, and publish digital content assets, for content and campaigns across iTunes Store, Music, App Store, TV App, and Books. The Platform Publisher will also support an enhanced focus in music as a specialist for Platform Publishing. This will be a non-traditional 40 hrs/week: Weds - Sun. Department Summary: The Global Platform Publishing team implements and deploys on-service/in-store offerings across products Key Qualifications:  You must have a minimum experience of 3 years with web-based Content Management Systems  You show familiarity with bug tracking/ticketing systems  You exhibit a strong attention to detail, and enjoy developing operational efficiencies  You have experience working directly with editorial teams as well as Creative teams  You communicate clearly and effectively across multiple partners at all levels of the company  You are comfortable setting and enforcing deadlines, and managing workflows  You're proactive and solutions oriented, always driving toward a better process for yourself and the team at large  You have a deep familiarity with (Mac OS X, iOS, iTunes, App Store, iBooks, Podcasts, iTunes U, Trailers, TV+, etc.)  Experience with music content is a plus.  A knowledge of HTML/CSS/Perl/PHP/Python is a plus  You are well versed in pop culture, media, and are passionate about entertainment. Description: The Platform Publisher works closely with Editorial, Creative, and Production teams to manage, assemble, QA, and publish digital content assets across desktop, TV+, and mobile devices. An expert across our back-end content management systems (CMS) as well as our front-end client featuring apparatus, a Platform Publisher collaborates with local editorial to advise on what's possible, test new approaches, and guide teams to successful solutions. With a unique view into many concurrent projects, an effective Publisher is able to provide a service akin to an air traffic controller, deploying current updates while simultaneously queuing up future initiatives. Thorough and robust Staging/QA efforts ensure our campaigns are timely and error-free and preserve a high-quality customer experience. Increasing organizational efficiency, and maintaining featuring accuracy, a Platform Publisher fills a key role in safeguarding the integrity of the Media Products ecosystem. Education: Bachelors Degree||https://job-openings.monster.com/platform-publisher-music-culver-city-ca-us-walkwaters-technologies/219428902|219428902|monster|Python
new|Sr. Business Intelligence Analyst|Wescom Central Credit Union|Pasadena, CA|2020-08-07|POSITION SUMMARY:The Senior Business Intelligence Analyst will support Wescom through the effective access and manipulation of business data using analytical methods to surface key insights into business performance, including but not limited to deep understanding of Members, their journeys, behaviors, and experience as they interact with existing products and services. The Senior Business Intelligence Analyst will also support the development of future organizational product and service goals through the development of benchmarks, measuring results, and reporting on performance with various segmentation and behavior characteristics.The successful candidate will play a key role in supporting key objectives of the Business Analytics Department, including the deployment, maturation, and adoption of the Enterprise Data Warehouse & analytical capabilities to further strategic business objectives. The position will report to the Business Analytics Manager and work closely with VP of Business Analytics and most departments throughout Wescom on an ongoing basis.ESSENTIAL POSITION FUNCTIONS:Extract and integrate data from multiple databases / systems via SQL and reporting tools to support to prepare, validate, and publish recurring reports, perform ad-hoc descriptive and prescriptive analytics, and provide interpretation of observed data trends & patternsAssist the deployment, maturation, and adoption of an Enterprise Data Warehouse & Business Intelligence reports, dashboards, and self-service analytical capabilities using variety of access tools, including SQL, SAS, Python, Tableau, etc.Perform data exploration, data visualization, and/or text analytics to better understand Wescom members & sub-segments, their journeys & behaviors, and to glean new insights to help grow members, offer relevant products & services, and improve the member experienceUtilize expert-level data access, data manipulation, and data validation skills with strong statistical & quantitative best practices to meet timely and high-quality delivery of various commitmentsUtilize internal & external data to extract member data for building demographic profiles of Wescom members to better determine future opportunities of product and service offeringsSupport the delivery of reports and dashboards for senior management and various committeesSummarize and explain analytical findings to enable data-driven business decision makingSupport the annual development of forecast for Key Performance Indicators (KPIs)Document and ensure various department processes are performed according to best practices, corporate policies, and any applicable regulationsAbility to deliver within tight deadlines and effectively prioritize and manage multiple concurrent assignmentsEDUCATION, EXPERIENCE, SKILLS AND ABILITIES:Bachelor's degree in Engineering, Statistics, Computer Science, Data Science, or other similar disciplines is required; Master degree or graduate-level coursework in a related discipline is preferredMinimum 5+ years of hands-on experience in Business Analytics, Data Analytics, Data Science, or similar function at a Credit Union, Banking, or Financial Services organizationStrong analytical background with experience in navigating, querying, & combining diverse data sets across multiple systems utilizing SAS, SQL, Python, R, and/or other programming tools & languagesTeam player with great interpersonal and communication skills, in dealing with individuals at all levels of the organizationAbility to analyze and understand complex and/or technical concepts and be able to explain them in laymans terms to management and non-technical stakeholdersDetail oriented self-starter with good self-organization and time management skillsAbility to work in a fast paced environment with concurrent and shifting prioritiesExperience working on cross-functional analytical business use cases is preferredCOMPUTER SKILLS:Demonstrated knowledge and strong hands-on experience with SQL, SAS, Python, and/or similar tools to query & manipulate data, analyze it, and document findings in an easy-to-understand mannerWorking knowledge and understanding of Data Warehousing, Business Intelligence, and/or Data Management concepts and best practices.Demonstrated working experience with Tableau, Power BI, and/or similar Business Intelligence, visualization, & dishoarding toolsProficient in Microsoft Applications (Word, Excel, PowerPoint, Outlook).Working experience with statistical, predictive, and similar computational models is desired.Working experience with Customer Analytics, Advanced Analytics, Digital Analytics, Master Data Management (MDM), Machine Learning (ML), and/or Artificial Intelligence (AI) is desiredWorking experience with Python statistical, text analytics, and/or visualization packages is preferredWorking experience with AWS, Azure, Hadoop, NoSQL, Hive, and/or similar technologies is preferredWorking experience with Credit Union and/or Bank and their core systems and specialized software (e.g. Symitar/Epysis) is preferredWorking experience with SAS Base, Enterprise Guide, Enterprise Miner, Visual Analytics, or similar SAS packages is preferredMATHEMATICAL SKILLS:Ability to add, subtract, multiply and divide in all units of measure, using whole numbers, common fractions and decimals. Ability to compute rates, ratios and percentages.PHYSICAL DEMANDS:The physical demands described here are representative of those that must be met by an employee to successfully perform the essential functions of this job. While performing the duties of this job, the employee is frequently required to stand; walk; sit; use hands to finger, handle or feel; reach with hands and arms, climb or balance, stoop kneel, crouch, crawl; talk or hear and taste or smell. The employee must occasionally lift and/or move up to 10 pounds. Vision abilities required by this job include close vision, distance vision, color vision, peripheral vision, depth perception and ability to adjust focus.WORK ENVIRONMENT:The work environment characteristics described here are representative of those an employee encounters while performing functions of this job.The noise level in the work environment is moderately quiet. It is a non-smoking environment.The above job requirements are representative of minimum levels of knowledge, skills, and abilities. The marginal functions have not been included. Reasonable accommodations may be made to enable individuals with disabilities to perform the essential functions.This job description in no way implies that these are the only duties to be performed. An employee will be required to follow any other job-related instructions and duties as requested by the supervisor and/or management.||https://job-openings.monster.com/sr-business-intelligence-analyst-pasadena-ca-us-wescom-central-credit-union/219126497|219126497|monster|Python
new|Data Engineer - Spark|Virtusa|Culver City, CA|2020-07-31|Multiple positions - Looking for a hands-on Data Engineers for a long-term contract with one of our Tech clients, the candidate can work out of Cupertino or Culver City CA locationsOpen to hiring full-time, it is a long-term projectData Engineer must have,Expertise in Spark, worked with MLlib, Avro schemas, Spark SQL, Core Spark API, Spark StreamingExpertise in ScalaStrong in writing complex SQLsGood with programming in Java or Python||https://job-openings.monster.com/data-engineer-spark-culver-city-ca-us-virtusa/216577144|216577144|monster|Python
new|Embedded Software Engineer|AUSGAR Technologies Inc|San Diego, CA|2020-08-13|Relocation AvailableAUSGAR Technologies, Inc., an EOE Minorities/Females/Disabled/Veterans employer, is a rapidly growing Service-Disabled Veteran-Owned Small Business (SDVOSB) Department of Defense, government contractor with core competencies in Information Assurance, Cyber Security and Systems Engineering. With offices on both the East and West coasts, an inviting culture, and above-standard benefits, opportunity abounds for the right individual!We have an exciting opportunityfor an Embedded Software Engineer to join Team AUSGAR's smart, innovative technical team members.Embedded Software Engineer  20-043Purpose: The Embedded Software Engineer will join a fastpaced group working to design and prototype embedded electronics systems used in autonomous ocean applications. Will continuously collaborate within a mediumsized team of electrical, computer and mechanical engineers, contributing to systems currently under development as well as to future systems. Will directly support the team by designing, developing and testing embedded firmware and software for multiple system components, using a variety of microcontroller and programmable logic devices. Will be involved in the development process from initial concept; to rapid design, development and testing; to inocean demonstrations.Job Description:Consult with mechanical and electrical engineers to help shape system designs to meet requirementsConsult with electrical engineers to design and develop system electronics (wire harnesses, circuit boards which will host the microcontrollers and/or programmable logic devices, etc.)Collaborate with firmware and software engineers to develop and integrate embedded firmware and software running on multiple devices, throughout each system design.Develop and test embedded firmware and/or software code to implement system requirements and featuresSupport team efforts to integrate prototype electronics components into engineering prototype systemsSupport iterative development and systemlevel testing with the firmware and software designsTest and debug embedded firmware and software designs in support of team efforts to understand and correct design and manufacturing flaws when they ariseDevelop and maintain design and manufacturing documentation and proceduresTotal Years of Related Experience for Position: 5+Job Requirements: The physical demands and work environment described here are representative of those that must be met by an employee to successfully perform the essential functions of the job. Reasonable accommodations may be made to individuals with disabilities to perform the essential functions.Bachelor's or higher degree in Electrical Engineering, Computer Engineering or Computer Science from an accredited programAbility to obtain a SECRET security clearance, or (preferred) an active SECRET security clearance5+ years of experience in one or more of the following areas:Microcontroller firmware design and testingFPGA firmware design and testingProficiency in one or more of the following languages:CVHDLBasic knowledge of electronics testing instruments (oscilloscopes, multimeters, power supplies, etc.)Basic knowledge of electronics troubleshooting (measure voltage and current, continuity checks, etc.)Working knowledge of embedded interchip communications (SPI, I2C, RS232, Ethernet, etc.)Ability to read, understand, and interpret complex technical documentsAbility to communicate complex ideas orally and visuallyFamiliarity with basic configuration controlProficiency in Microsoft Office software (Outlook, Word, Excel, PowerPoint, and Visio)Strong organizational and timemanagement skillsOptional Additional Qualifications:Working knowledge of Python a plusExperience in one or more of the following areas:Linux kernel device driver developmentLinux embedded application developmentEmbedded digital signal processing (DSP)An essential qualification for this position is successfully obtaining a Secret security clearance issued by the Federal Government, which may require successful completion of a background check.AUSGAR Technologies, Inc.is an equal employment opportunity and affirmative action employer. AUSGAR Technologies, Inc.is committed to engaging in affirmative action to increase employment opportunities for females, minorities, protected veterans, and individuals with disabilities. We are an EOE - Minorities/Females/Disabled/Veterans.||https://job-openings.monster.com/embedded-software-engineer-san-diego-ca-us-ausgar-technologies-inc/219499001|219499001|monster|Python
