status|title|company|location|date|blurb|tags|link|id|provider|query
new|Site Reliability Engineer (SRE)|Apple|Austin, TX|2020-07-15|||||indeed|Python
new|Linux Python Software Tools and Automation Engineer Sunnyvale and Austin|OSI Engineering|austin, TX|2020-08-13|Linux Python Software Tools and Automation EngineerDevelop Python Tool Applications for Automation to process consumer electronic devices.Qualifications:Experience building tools and applications in Python3, including using frameworks like DjangoAbility to write Plug-ins for triage issuesKnowledge of standalone web applications using tools such as NodeJS/TypescriptExperience working with software development tools such as git, code review, and CI/CD systems is highly desired.Must have efficiency of manufacturing processExcellent written and verbal skillsPlease submit resume to jobs@OSIengineering.comType: ContractDuration: 6 MonthsLocation: Cupertino OR AustinTony Do408.550.2800 x115OSIJOBS||https://job-openings.monster.com/linux-python-software-tools-automation-engineer-sunnyvale-austin-austin-tx-us-osi-engineering/219505928|219505928|monster|Python
new|Senior Python Developer REMOTE - Python, Java|CyberCoders|Austin, TX|2020-08-10|If you are a Senior Python Developer with experience, please read on!THIS JOB IS 100% REMOTE Based in sunny Austin Texas, we are a top of the line security company. Out focus is helping people protect their data and their freedom so that they do not have to worry. We believe that having people understand and teaching them about their security awareness is key. We are looking for a Remote Senior Python Developer to join our fun company.Top Reasons to Work with Us- Core Values: Empowerment, Integrity, Innovation, Respect, and Giving Back - Excellent Mentorship Program - Company Ownership- Remote Working LocationsWhat You Will Be Doing- Build, prototype, and test biomedical code using best practices- Assist in the build of their new development infrastructure and the development of algorithms for genetic data- Participate and contribute to the on the front end and backend of internal and client-facing software tools- Collaborate with scientific and research team members to ensure scientific specifications are metRequirementsWhat You Need for this Position- Python- Java- ElasticSearchGOOD TO HAVE - Rest- AWSWhat's In It for You- Competitive Compensation: (100-140K DOE)- Vacation/PTO - Unlimited - Medical- Dental- Vision- 401kSo, if you are a Senior Python Developer with experience, please apply today!||https://job-openings.monster.com/senior-python-developer-remote-python-java-austin-tx-us-cybercoders/219514303|219514303|monster|Python
new|Python Software Developer - Austin - $180,000 + Bonus|Oscar Associates Limited (US)|Austin, TX|2020-08-06|Python Software Developer - Austin - $160,000 - $180,000 + BonusA company working with Computer Vision and AI to build industry leading products, who are established across Asia and Europe, is looking to build a brand-new team in the Austin to build their products and bring them to the US market. This will be a great opportunity to work on some greenfield products with the latest technologies in facial recognition AI. If this sounds interesting to you, please apply below!THE COMPANY:The company has spent the last 2 years building top-quality facial recognition software that it being implementing in cameras all over the world. Their latest product is using a combination of facial recognition technology and thermo technology to detect the temperature of a person before entering buildings, This is already being implemented in schools in China to protect against COVID-19.THE ROLE:Your role working as a Python Software Developer will involve:Developing high quality, testable and performant softwareApplying TDD and BDD approached to your workBuilding large scale service-oriented systemsOptimising software performanceRestful API design and developmentWorking in a real-time environmentSupport and maintain the applicationsCollaborating with the other team membersYOUR SKILLS & EXPERIENCE:What your role as a Python Software Developer will require:Degree in Computer Science or similarExtensive Python Software Engineering experienceBackend expertise and experience architecting scalable applicationsKnowledge of data structures and algorithmsExperience with AWS cloud technologies with Docker and KubernetesStrong verbal and communication skillsAbility to work in a high-performance development teamPython Software Developer - Austin - $160,000 - $180,000 + BonusOscar Associates Limited (US) is acting as an Employment Agency in relation to this vacancy.||https://job-openings.monster.com/python-software-developer-austin-180-000-bonus-austin-tx-us-oscar-associates-limited-us/219355824|219355824|monster|Python
new|Senior Python/Django Engineer|Jobot|Austin, TX|2020-07-31|"Hot Startup Still Rapidly Growing - 100% Remote/WFHThis Jobot Job is hosted by: Dee NguyenAre you a fit? Easy Apply now by clicking the ""Apply Now"" button and sending us your resume.A bit about us:We are building systems to track traffic in buildings and spaces. If you're an experienced python/django with AWS experience, please submit your resume for further consideration.Why join us?Huge Room for Growth Great Pay and Benefits Work/life Balance Remote OptionJob Details5+ years of highly scalable enterprise systems experiencePython/DjangoAPIAWSArchitected complex data pipelinesnice to have:React/reduxES6Interested in hearing more? Easy Apply now by clicking the ""Apply Now"" button."||https://job-openings.monster.com/senior-python-django-engineer-austin-tx-us-jobot/219238243|219238243|monster|Python
new|Sr Backend Engineer - Java, Ruby, Python, GoLang|New Iron|AUSTIN, TX|2020-08-14|Sr Backend Engineer - Java, Ruby, Python, GoLangNew Iron is leading the search for a Sr Backend Engineer to join a dynamic rapidly growing startup in Austin,TX.This is a challenging direct-hire role to build and ensure server-side performance of large-scale applications.You will join a team focused on backend platform development. Though not required, priority will be given to candidates with experience in GoLang, and candidates with a strong desire to learn GoLang.We are looking for engineers who are excited about backend features, ownership of the design and implementation of core services, and learning tools needed for how it runs and scales in production.If you are focused on the craftsmanship, continuous improvement, and team success, we'd love to speak with you!Responsibilities:Design, implement, test and deploy software servicesRaise the bar on code quality, reusability and maintainabilityEnsure responsiveness, scalability and maintainability of platformLeverage the latest in container based software distribution, microservicesDeliver highly scalable and performant data pipelinesLeverage serverless and containerized compute to balance cost, latency, and durationBuild and extend CI/CD pipelines for automated testing and continuous production releasesFind and solve response time and throughput performance issuesRefactor for optimal performance and scalabilityFoster a test-driven culture and share best practicesWork closely with team members and stakeholdersRequired Skills:3+ years of experience in software developmentExperience with server side programming languages such as Java, Ruby, Python, etc.Experience with server side MVC frameworks such as Spring, Rails, .NET etc.Experience with database languages esp. SQLStrong understanding of OOP and design & architectural patternsExcellent communication, collaboration, and time-management skillsThe following is a strong plus:GoLang programming languageExperience building scalable microservices or serverless APIsExperience performance tuning microservices and/or data pipelinesCloud base security experienceExperience with open source web frameworks esp. DjangoExperience in DevOps open source tools such as Docker, Terraform, etc.Experience with AWS cloud servicesExperience with Software services for Billing/InvoiceBS degree in Computer Science or relatedThis is a direct-hire role for a client based in Austin, TX. Principals only. Recruiters please do not contact this job poster.||https://job-openings.monster.com/sr-backend-engineer-java-ruby-python-golang-austin-tx-us-new-iron/219525642|219525642|monster|Python
new|DevOps Engineer (Can be Remote) - Python, AWS, Devops|CyberCoders|Austin, TX|2020-08-10|If you are a DevOps Engineer (Can be Remote) with experience, please read on!Based in sunny Austin Texas, we are a top of the line security company. Out focus is helping people protect their data and their freedom so that they do not have to worry. We believe that having people understand and teaching them about their security awareness is key. We are looking for a DevOps to join our fun company.Top Reasons to Work with Us- Core Values: Empowerment, Integrity, Innovation, Respect, and Giving Back - Excellent Mentorship Program - Company Ownership- Remote Working LocationsWhat You Will Be Doing- Lead mission-critical technology projects to improve the product and processes- Collaborate with engineering teams to streamline the provisioning and automation of multiple deployment environments- Support engineering teams in enhancing cloud capabilities within the product- Monitor and maintain mission-critical components across our Hybrid SaaS offerings.- Drive automation following infrastructure as code model and using SDLC best practices- Work with security team to design and implement practices for securely managing and deploying Brainsharks technology stack- Respond to and resolve critical customer issues as part of the on-call rotationWhat You Need for this Position- Python- AWS- Devops- SQLWhat's In It for You- Vacation/PTO - Unlimited - Medical- Dental- Vision- 401kSo, if you are a DevOps Engineer (Can be Remote) with experience, please apply today!||https://job-openings.monster.com/devops-engineer-can-be-remote-python-aws-devops-austin-tx-us-cybercoders/219514299|219514299|monster|Python
new|Senior Python Developer - Austin - $150,000 + Bonus|Oscar Associates Limited (US)|Austin, TX|2020-08-07|Senior Python Developer - Austin - $150,000 + BonusA highly prestigious finance company in the heart of downtown Austin is looking to add a new member into their Software Team. This team is responsible for designing and building highly reliable, and testable Python Systems to ensure trading can take place. They are looking for a Senior Python Developer who is comfortable coding Python, testing their code and developing on Linux-based systems. If this sounds like you, then apply below!THE COMPANY:The company is well-established with 1,500 employees distributed across several geographical locations. They are a platform on which clients can trade products and services. They also build high performance software product to facilitate trading. They are the global leaders in their domain.THE ROLE:You will join a Software Engineering team of 7, and your responsibilities will include:Designing and building highly reliable and testable Python systemsIntroducing innovative ideas alongside the business and sales to develop new productsFollowing agile software development techniquesContribute to R&D projectsIdentify and voice new technologiesParticipate in the global software engineering teamYOUR SKILLS & EXPERIENCE:What your role as a Senior Python Developer will require:Demonstratable commercial experience building software in PythonStrong advocate of TDD, BDD and other testing methodsFamiliarity with SQLStrong Linux knowledgeDegree or equivalent in Computer ScienceExperience working within a financial domain is preferred but not necessaryStrong communicator and team player THE BENEFITS:Additional benefits include benefits:Medial insuranceBonus21 days holidayCasual dress codeFree lunchRetirement plan with matching contributionsGroup health planGym membershipIf you are interested or would like some more information, please send your latest CV to antoni.davis-phillip@oscar-tech.comApply Now!!Senior Python Developer - Austin - $150,000 + BonusOscar Associates Limited (US) is acting as an Employment Agency in relation to this vacancy.||https://job-openings.monster.com/senior-python-developer-austin-150-000-bonus-austin-tx-us-oscar-associates-limited-us/219117423|219117423|monster|Python
new|Python Developer|Jobot|Remote, TX|2020-08-04|"100% Remote Senior Python Developers Needed @ Fast-growing SaaS Tech StartupThis Jobot Job is hosted by: Luke SwiftAre you a fit? Easy Apply now by clicking the ""Apply Now"" button and sending us your resume.Salary: $100,000 - $130,000A bit about us:Our powerful SaaS platform connects customers to real estate agents and help them save money in the process (sellers get a discount on commission, buyers get a rebate on their home purchase).We are now seeking several REMOTE Software Engineers (Mid/Senior level) with a background developing customer-facing SaaS and web-based applications experience, primarily with Python and Django.  In this role, you'll do a lot of paired-programming with several members of our team the first few months in order to familiarize you with our existing systems and to build relationships with the rest of the Engineering team.  You either should enjoy it or at least be willing to do paired-programming, otherwise this isn't the right opportunity for you.   They should be well-versed with server-side technologies such as RESTful APIs, Amazon Web Services, CI/CD tools, and databases (PostgreSQL/NoSQL).  Any experience with JavaScript and React.js is highly desired, but not required as we will ramp you up on them and any of the other technologies we use in no time.  Lastly, this is a great time to get in on ground floor working alongside the Founders, CTO, and a key hire in shaping the way the organization's future goes. If this sounds like you, please apply now!Why join us? Marquee Product! WORK FROM HOME! Accelerated Career Growth!Job DetailsDay to Day: Develop, maintain, and enhance our powerful SaaS platform Take ownership by creating your own technical specs because as a small team, you are given personal ownership of the planning processes. Collaborate a lot with each other and with product stakeholders.  Participate in the spec processes for new features and epics on our roadmap, and you'll help others resolve issues when they have questions about certain parts of the codebase that you've gained familiarity with.  Establish strong working relationships with individuals inside and outside of Engineering, and you'll have a clear understanding of both our customer journey and the workflows of our internal stakeholders.  Tackle small bugs and features while performing root-cause analysis for bugs independently, escalating to other teammates when you need a second set of eyes.  Use the business context you've picked up to discuss the priority of features and bugs in the backlog.  Advocate a new trend or tool that will help us perform root-cause analysis more easily when issues come up.Requirements: 4+ years of Software Development experience At least 2 years of development experience on a consumer-facing SaaS or web-based application products Experience and/or willingness to participate in paired-programming (No Exceptions) Advanced with Python programming  Experience with Django or similar python web framework (Flask) Experience with RESTful API design & development Experience with RDBMs (PostgreSQL) and NoSQL databases Experience working within an Amazon Web Services (AWS) environment Familiar with CI/CD and DevOps tools and best practices is highly desiredNice to have skills:, but not required:  Proficient with web technologies such as JavaScript, HTML, CSS Experience with ReactJS is highly desiredInterested in hearing more? Easy Apply now by clicking the ""Apply Now"" button."||https://job-openings.monster.com/python-developer-remote-tx-us-jobot/219315823|219315823|monster|Python
new|Senior Full-Stack Engineer - Python, Java, REACT|CyberCoders|Austin, TX|2020-08-05|If you are a Senior Full-Stack Engineer with experience in both front-end and back-end technologies, as well as with Linux, please read on!Located in Austin, Texas, we specialize in providing our customized digital innovation platform to all of our clients within the finance space. We have been in business for over 5 years and are continuing to grow and expand our business at a very rapid pace! We were named one of the fastest growing companies for the 3rd year in a row, and are continuing to shine! We are looking for a skilled Senior Software Engineer, who is going to be strong with both front-end and back-end technologies, as well as a heavy background in Linux. We aren't married to specific technologies, but use Python on the back-end, and JavaScript, HTML, CSS, Angular/React on the front-end. Someone with this type of experience would be a PLUS but we are open. Your experience with Linux is a MUST as we are a Linux shop and want someone who can hit the ground running! We work collaboratively in a team environment here so someone with this mentality will love it here.What You Will Be Doing-Working with both front-end and back-end technologies-Utilizing Linux-Collaboratively working in a team environmentWhat You Need for this Position- Python/Java/C++- React/Node/Vue/Angular- - LinuxSo, if you are a Senior Full-Stack Engineer with experience in both front-end and back-end technologies, as well as with Linux, please apply today!||https://job-openings.monster.com/senior-full-stack-engineer-python-java-react-austin-tx-us-cybercoders/219414185|219414185|monster|Python
new|DevOps Engineer|Tasacom|Austin, TX|2020-08-12|Job Title: DevOps Engineer Location: Austin, TXDuration: Long termRequired Skills:AWS (Optional)Python ScriptingCI/CDGithubJenkinsDockerLinux/ UnixAnsible and Kubernetes--Thanks &Regards,Abdul Khaliq972-456-9555abdul@tasacom.com||https://job-openings.monster.com/devops-engineer-austin-tx-us-tasacom/219470889|219470889|monster|Python
new|Sr. Software Engineer (GCP- Google Cloud Platform)|Synthesis Systems||2020-07-17|Job DescriptionWe are looking for a Software developer who has an overall 7 plus years of experience and a minimum of 2 yrs. of working experience withGoogle Cloud environment.Primary skills involveNode.js or Java, and proven skills to code/deploy/test Cloud Functions in GCP.The assignment involves composing Lightweight APIs using Cloud functions that are quick to build and scale as serverless deployment. The APIs could be event driven or invoked direct over HTTP/S.ResponsibilitiesCollaborate closely with program managers, partner teams, and customers, while designing and developing features.Play an active role in designing and coding.Work independently and in a team setting and be able to research innovative solutions for challenging technical problemsQualificationsExperience with Lift/Shift/Scale Provisioning D2 (Partners/Wholesale  Cloud Functions)Scripting skills  python, and terraform.Strong design and programming skills in Java/Python/Terraform.Excellent analytical skillsExcellent communication skills, including the ability to write concise and accurate technical documentation, communicate technical ideas to non-technical audiences, and to lead development teams.Demonstrated ability to impact/influence engineering and project teamsProven track record of shipping highly-scalable and reliable services/systemsAbility to work independently and in a team setting and be able to research innovative solutions for challenging business/technical problemsExpertise and knowledge in modern engineering practices (Continuous Integration, TDD, automated deployments with integrated quality gates)Experience designing and implementing RESTful APIsExperience with microservices architecture and Google Cloud environment/Platform (GCP)||https://job-openings.monster.com/sr-software-engineer-gcp-google-cloud-platform-us-synthesis-systems/218995191|218995191|monster|Python
new|Devops|Oliphant USA|Austin, TX|2020-07-15|POSITION SUMMARYThe Devops duties will include managing systems performance, providing tech support, developing in-house software, and mitigating potential risk.PRIMARY RESPONSIBILITIESPerform day-to-day IT maintenance tasks. Oversee job automation.Participate in software development.Provide assistance to computer users.Participate in network administration and maintenance.Install, modify, and repair computer hardware and software.The duties of this position are subject to change at the discretion of the Company. Management is authorized to assign other duties at any time and the employee may be assigned, temporarily or regularly, to another position at any time.JOB REQUIREMENTSProblem-solving skillsExperience with computer networking and Windows DomainsOptional experience with UNIX systems and DockerAbility to use collaboration software (version control, tickets, etc.)Knowledge of programming languages such as Python, C#, SQL and moreAbility to work productively with minimal supervisionAbility to work in a highly regulated environmentWork ContextTypical Physical Requirements:Sit for extended periods; frequently stand and walk; verbal communication; use of office equipment, including computer, telephone, calculator, copiers, and fax.Background Check Requirements:This position requires successful completion of an initial and annual criminal history background check.TOTAL REWARDS PACKAGESalary:NegotiableBENEFITSAmong other benefits, Oliphant USA also offers comprehensive medical, dental, and vision insurance, company paid group term life insurance, nine (9) paid holidays, and paid time off (based on years of service).Additional benefits of working at Oliphant USA include:Business casual dressCulture founded upon open-door policies, team-orientation, and customer focusFree beverages, including tea and coffeeCompany sponsored social events and outingsOliphant USA, LLC is an Equal Employment Opportunity Employer.||https://job-openings.monster.com/devops-austin-tx-us-oliphant-usa/218940871|218940871|monster|Python
new|Integration Lead|Prism IT Corporation|San Antonio, TX|2020-08-10|Job Title/Role:Integration LeadMinimum Mandatory Skills:Snaplogic, Python, SQL(Snaplogic certification highly preferred) - Do share the skill matrixJob Location:San Antonio, TX/ San Francisco, CAClient Name:ASANAWork Authorization:USC/GC Highly PreferredInterview Preference:Skype/ TalviewJob Description:Asana is home to problem solvers and creative thinkers from across the globe who are dedicated to helping teams achieve their goals.Were looking for extraordinary people to share their experience and expertise. Searching for your dream job? At Asana, we strive to help our employees find passion and purpose. Join us and help shape the future of work.The Business Technology team at Asana acts as the engine to the business team; up-leveling our business partners by delivering secure, scalable, and efficient systems, processes, data and insights that help Asana achieve its mission. As Integrations Technical Lead, you will be leading medium to large complex initiatives with a team of engineers. This role will be extremely cross-functional, working closely with all departments of the company like Sales, Marketing, Finance, Data Engineering, and Product. The Integration teams mission is to accelerate the business by connecting systems and data seamlessly.We are looking for an Integrations Lead Engineer with experience as a technical lead for a team and/or programs. You should have expertise with Enterprise System Integrations and Business Process Automation to oversee the team who will be building the mapping, design, documentation and implementation of various system integrations.What youll achieveOversee the teams responsibility for architecting and designing, vetting, developing integrations between complex systems and/or integrations between existing solutionsWork with your manager and across Business Technology to define the long-term strategy of the Integrations teamPartner with your manager and other team leads to prioritize work for the team based on requirements and build out roadmaps and sprints using agile best practicesEnsure that the teams toolstack are the best-in-class and are kept informed on the newest trends of integrationsEstablish trust and strong relationships with senior leaders, operation managers, and other BT team leads as it pertains to business processes and integrationsMentor and guide the engineers on the team around integration best practices and patterns, software engineering architecture principles, and conceptsEnsure creation of accurate and clear technical documentation; develop support processes and procedures; and support hand-off to peers/organizational unitsImplement and uphold data security processes and methods for the teamJob Details8+ Years of experience inSnaplogic, Python, SQL.Experience in Application Support and Development.Write Python code based on functional specification and technical design.Develop statistically sound analytic solutions to support company-wide decisions.Experience on AWS S3 and Amazon Redshift, Athena, Snowflake, SQL.Ability to provide solution using Snaplogic.Strong in SQL queriesShould have Hands on Design, development, deployment, maintenance of integration processes between applications across cloud and/or on premise using Snaplogic cloud platformExperience in Snaplogic Designer and Creation of Snaps and PipelinesAbility to Build Scalable Pipelines across cloud and on premise systems||https://job-openings.monster.com/integration-lead-san-antonio-tx-us-prism-it-corporation/219522578|219522578|monster|Python
