status|title|company|location|date|blurb|tags|link|id|provider|querynew|BI Solutions Engineer|Fidelity TalentSource|Boston, MA|2020-08-04|Fidelity TalentSource is your destination for discovering your next temporary role at Fidelity Investments. We are currently sourcing for a BI Solutions Engineer to work in Fidelitys Asset Management Technology in Boston, MA.The TeamStrategic Advisors Technology is seeking a highly motivated Solutions Engineer to join our Shared Services BI Reporting Team. This role will focus on developing new reports and supporting existing reports, partnering very closely with Strategic Advisors investment and operations teams to deliver innovative, efficient, and timely solutions.The Expertise Were Looking For5+ years of industry experience as a BI solutions engineer and developer.B.S. degree in math, statistics, computer science, or equivalent technical fieldExperience with report development, data science, business analytics, business intelligence or comparable data engineering role, including data warehousing and business intelligence tools, techniques and technology.Skills in developing interactive dashboards and impactful visualizations with OBIEE and Tableau.Knowledge of ETL and data warehouse concepts and processes.Knowledge of SQL to write sophisticated, highly-optimized queries across large volumes of data.Experience with R, Python and D3 will be a plus. Familiarity with Spotfire will be useful for transitioning the legacy reports to Tableau.The Purpose of Your Role As a Business Intelligence (BI) Solutions Engineer for Strategic Advisors, your role is to be an authority in understanding our data, give it meaning and derive intelligence. We expect you to aid our business teams in drawing insights, knowledge and wisdom from our data. You will build dashboards, reports, visualizations, algorithms, and tools to tackle exciting business problems for users across the enterprise. If you: are a sharp coder; can identify problems in sophisticated data; know the difference between clear visualizations and confusing ones; like to think of creative ways to resolve tricky data problems; and you love engaging with people, this is a superb opportunity for you.The Skills You BringYou can explain complicated or technical information in a simple way to non-technical audiences.You have an ability to set realistic expectations and prioritize within a dynamic and shifting environmentYou are sensitive to clients' needs and have an ability to develop relationships and engage users.You have curiosity and passion about data, visualization and solving problems.You have creativity to determine the best solution for a real-world problem with quantitative data.You have willingness to question the validity, accuracy of data and assumptions.The Value You DeliverUnderstanding your business users objectives, the metrics and visualizations that are the most important to them, and how to best deliver impactful insights.Recommending the right BI tool and implementation strategy given the problem statement.Turning business requirements into technical requirements.Coding reports, dashboards, and visualizations to help your partners gain insight.Learning from and sharing knowledge and skills with your peers to grow BIs total impact to the organization.Crafting, building, deploying and maintaining BI solutions (primarily with Tableau and OBIEE).How Your Work Impacts the OrganizationFidelity Asset Management Technology provides worldwide technology and support to all the Portfolio Management, Research, Trading and Investment Operations functions. Asset Management Technology is an integral partner for Asset Management to deliver innovative, scalable, industry-leading investment tools that enables the business to achieve competitive advantage globally.Company CultureAt Fidelity, you can find it all here. We reward results-oriented, hardworking individuals with a work environment that champions diversity, partnership and collaboration as well as encourages innovative ideas and fresh thinking. We recognize the value that employees individual differences can contribute to the forward-thinking and strong future of our company.Company OverviewFidelity TalentSource, formerly Veritude, is the in-house temporary staffing provider for Fidelity Investments, one of the largest and most diversified global financial services firms in the industry. We recruit individuals from a variety of backgrounds, including technology and customer service, to fill assignments across Fidelitys U.S.-based regional and investor center locations. If you would like to experience Fidelitys diverse and inclusive workplace while growing your skillset and developing your professional network, consider a role with Fidelity TalentSource.For information about working at Fidelity TalentSource, visit FTSJobs.com.Company OverviewFidelity TalentSource, formerly Veritude, is the in-house temporary staffing provider for Fidelity Investments, one of the largest and most diversified global financial services firms in the industry. We recruit individuals from a variety of backgrounds, including technology and customer service, to fill assignments across Fidelitys U.S.-based regional and investor center locations. If you would like to experience Fidelitys diverse and inclusive workplace while expanding your skill set and developing your professional network, consider a role with Fidelity TalentSource. For information about working at Fidelity TalentSource, visit FTSJobs.com.Information about Fidelity InvestmentsAt Fidelity, we are focused on making our financial expertise broadly accessible and effective in helping people live the lives they want. We are a privately held company that places a high degree of value in creating and nurturing a work environment that attracts the best talent and reflects our commitment to our associates. We are proud of our diverse and inclusive workplace where we respect and value our associates for their unique perspectives and experiences. For information about working at Fidelity, visit FidelityCareers.com.Fidelity Investments and Fidelity TalentSource are equal opportunity employers.||https://job-openings.monster.com/bi-solutions-engineer-boston-ma-us-fidelity-talentsource/ffba056d-01b0-4484-a81a-34089b1ee5ad|ffba056d-01b0-4484-a81a-34089b1ee5ad|monster|Python
new|Software Engineer - Return-to-Work Program|reacHIRE|Smithfield, RI|2020-07-16|OverviewreacHIRE is proud to partner with leading financial services corporation Fidelity Investments for a 6 month return-to-work program starting in October 2020 designed for Software Engineering professionals returning to the workforce after a 2+ year career break. Please note candidates who have worked in part-time roles or have done independent contracting will be considered for this opportunity. It is a cohort-based model that allows individuals to re-enter the workforce in a supported way with a group of fellow returning professionals. We provide a one-week intensive onboarding specially designed to build the skills needed to successfully re-enter the workforce. This proven approach fosters camaraderie among colleagues, builds confidence and upgrades technology and professional skills that will be invaluable throughout this next phase of their career.At reacHIRE, we are committed to safeguarding the health and well-being of our associates, clients, and candidates. In partnership with Fidelity, we are actively monitoring the situation related to COVID-19 and are continuing to hire in order to serve Fidelity's needs. To ensure your safety as a reacHIRE candidate, we will be relying on virtual interviewing and other digital communications. Our recruiting team is committed to providing the support you need throughout the hiring and onboarding process. We appreciate your understanding and flexibility during this time.ResponsibilitiesWe are currently seeking a qualified, knowledgeable IT Professional to help our company develop, use, and integrate IT systems. S/he will be responsible for resolving technical problems and providing training to users to improve the efficiency value of technology in business. An ideal candidate would be both highly knowledgeable and customer oriented. S/he would possess technical knowledge in all relevant areas and aptitude for problem-solving to provide business solutions by developing complex or multiple software applications. They demonstrate a proven understanding of the business or function for which the application is designed. The Purpose of your role In this role, you will serve as an IT Professional, responsible for the creation of quality web or cloud-based software components that are used by to support Fidelitys businesses and/or customers. You will work closely with the scrum master, systems analysts, architects, and other developers to design, build, test, and deliver the features that make up Fidelitys technology experience. You will design and implement technical solutions to achieve business goals for the product offering. You will also be encouraged to provide guidance and mentoring to the other developers within the teams in accordance with your skills and experiences. The Value you deliverYour understanding of the software development process including analysis, design, coding, system and user testing, problem resolution and planningYour use of formal methods (traditional structured or Agile/iterative) for delivering new or enhanced applications, identify and communicating systems development processes and developing work associated with the respective phases of the lifecycleYour ability to work with varying individuals and groups, both in person and virtually, in a constructive and collaborative mannerYou quickly learn, adapt and thrive to meet the needs of a fast paced, changing environmentYour ability to communicate effectively with and to influence team members and external groupsYour desire to be detail-oriented, very responsive and committed to qualityQualificationsThe Expertise were looking forBachelor's degree in Computer Science or equivalentProven proficiency of previous level skills and responsibilities of relevant job family4+ years development experience. Java preferred, Python or C acceptableExcellent communication skillsPassion for technology and can navigate across complex and rapidly changing landscapes.Are experienced with the tools of the trade including a variety of modern programming languages and frameworksThe Skills you bringDesign skills needed to help develop corporate IT systems and networks, ensuring the most effective architecture and functionality.Problem solving skills to revise existing systems and suggest improvements.Ability to produce concise yet thorough reports within IT and for other teams as needed.Analytical skills and ability to solve issues by making timely decisions based on facts, knowledge, experience and judgment.Knowledge and understanding of industry developments and trends related to the Information Technology (IT) functionExperience in Agile methodologies (Kanban, SCRUM)Possess knowledge and understanding of object oriented/functional programming (Java, Scala, Python or equivalent)About reacHIREreacHIRE is changing the trajectory for individuals in the workplace by partnering with forward-thinking companies. Through customized programs tailored to a company's unique business needs and culture, reacHIRE carefully selects under-the-radar, top talent who voluntarily off-ramped and are ready to on-ramp back into their career. At the end of the program, you may be eligible for full-time or extended contracting work with Fidelity, but it is not guaranteed. reacHIRE will provide 360 degree support along with a dedicated Program Manager to ensure your success every step of the way!About Fidelity Investments:Fidelity is passionate about making their financial expertise broadly accessible and effective in helping people live the lives they want. They are a privately held company that places a high degree of value in creating and cultivating a work environment that attracts the best talent and reflects their commitment to their associates. They are proud of their diverse and inclusive work environment where they respect and value their associates for their unique perspectives and experiences. For information about working at Fidelity, visit FidelityCareers.com.Fidelity Investments is an equal opportunity employer.||https://job-openings.monster.com/software-engineer-return-to-work-program-smithfield-ri-us-reachire/218964660|218964660|monster|Python
new|Sr Systems Engineer II|RTX|Roxbury, MA|2020-08-13|Sr Systems Engineer II - Marlborough or Tewksbury, MADo you enjoy tackling technical problems no one has solved before? Do you want to join a team that thrives on diversity of thought and innovative ideas?If you answered yes, then the Systems Integration and Test Directorate (SI&T) is interested in you. Our elite team integrates complex technology, debugging and resolving interface issues as we produce, demonstrate and deliver state-of-the-art software for areas including radars, command and control platforms, missile systems and cyber defense. As an integrator you will learn the design principles of new systems by attending design reviews to determine their architecture, operations and interfaces. As a Systems Engineer you will design specialized technical testing to demonstrate system performance to our customers. Join a world class team of systems engineers who are building defense technologies to make the world a safer place. Explore some of the systems you may be working with as a member of our team.Patriot: https://www.youtube.com/watch?v=b3GhlWKkrocBallistic Missile Defense: https://www.youtube.com/watch?v=ae5VmVwfWmkUSS Zumwalt: https://www.youtube.com/watch?v=EdjXkuMWXlQAir and Missile Defense Radar: https://www.youtube.com/watch?v=yNkUx9vguQ8Opportunities for Systems Engineers currently exist within SI&T's Ship and Radar Systems Integration (SRSI) Department in Marlborough, MA and Tewksbury, MA. SRSI personnel execute integration, verification, validation, and sell off for numerous defense programs with a primary focus on domestic and international radar systems.Duties and Responsibilities:Support system level integration and test planning, design, and executionPrepare plans, procedures, and test casesDevelop detailed integration information sheets and detailed verification information sheetsPerform integration and test activities in house or at site locationsUtilize DOORS to capture verification artifacts and maintain traceability to requirementsRequired Skills:6+ years of relevant work experienceExperience with programming in MATLAB, C/C++, Python, or other programming languageBachelor's Degree in Engineering, Science, Mathematics or related technical disciplineAbility to obtain a security clearance; only U.S. citizens are eligible for a security clearanceDesired Skills:Experience in radar systems test environments, and in development of test scripts and proceduresExperience with radar systems or signal processingExperience with testing in an AGILE environmentExperience with DOORS or a related databaseMaster's Degree in Engineering, Science, Mathematics or a related technical disciplineThis position requires the eligibility to obtain a security clearance.  Except in rare circumstances, only U.S. citizens are eligible for a security clearance. 164906Raytheon is an Equal Opportunity/Affirmative Action employer. All qualified applicants will receive consideration for employment without regard to race, color, religion, creed, sex, sexual orientation, gender orientation, gender identity, national origin, disability, or protected Veteran status.||https://job-openings.monster.com/sr-systems-engineer-ii-roxbury-ma-us-rtx/66a88434-9caf-41ac-a89f-c00971e8c010|66a88434-9caf-41ac-a89f-c00971e8c010|monster|Python
new|Software Engineer Lead, Technical Manager|Infineon Technologies Americas Corp.|Andover, MA|2020-08-13|"Part of your life. Part of tomorrow.We make life easier, safer and greener - with technology that achieves more, consumes less and is accessible to everyone. Microelectronics from Infineon is the key to a better future. Efficient use of energy, environmentally-friendly mobility and security in a connected world - we solve some of the most critical challenges that our society faces while taking a conscientious approach to the use of natural resources.Infineon Technologies Americas Corp. is an equal opportunity employer. All qualified applicants will receive consideration for employment without regard to race, color, religion, sex (including pregnancy, childbirth, or related medical conditions), gender identity, national origin, ancestry, citizenship, age, physical or mental disability, legally protected medical condition, family care status, military or veteran status, marital status, domestic partner status, sexual orientation, or any other basis protected by local, state, or federal laws. Applicants with questions about access or requiring a reasonable accommodation for any part of the application or hiring process should contact the Talent Network by phone at (408) 503-2194.Employment at Infineon is contingent upon proof of your legal right to work in the United States under applicable law, verification of satisfactory references and successful completion of a background check and drug test, and signing all your on-boarding documents.In some instances, if applicable, U.S. export control laws require that Infineon obtain a U.S. government export license prior to releasing technologies to certain persons. This offer is contingent upon Infineon's ability to satisfy these export control laws as related to your employment and anticipated job activities. The decision whether or not to submit and/or pursue an export license to satisfy this contingency, if applicable, shall be at Infineon's sole discretion.IMPORTANT NOTICE:Infineon Technologies takes data privacy and identity theft very seriously. As such, we do not request personally-identifiable information (PII) from applicants over the internet or electronically. Please kindly refrain from disclosing your PII electronically during the application process or to unauthorized websites that may purport to be Infineon or any of our affiliates.#LI-MA1Our global team, with over 40,000 employees, works to improve energy efficiency, enables new mobility concepts and provides for security in our digital age. With our innovative semiconductors and system solutions we contribute to a more sustainable future.This System Application Engineering role is part of Infineon's Enterprise Power business unit multiphase application team located in the Andover MA design center for the development of power management controller ICs and integrated power stages in computing, networking and telecommunication applications. The responsibilities include working closely with Applications Engineers to support firmware and software for new product development and customer design-in of the product(s) as described below.This position will lead an applications team of 3-5 in the development of firmware and software for Infineon power supply controller IC's. This includes working with and leading senior engineers to develop, test and validate the firmware/software inside the voltage regulator controller and customer user interface GUI (Graphical User Interface) for communicating with the IC. These voltage regulator controllers are designed into DC/DC voltage regulators that have applications into servers, graphic cards and communication systems. The engineer will also be required to support customer design-in and debug efforts on the product's firmware and the interface GUI.In your new role you will:Lead the firmware applications development for power supply controllers:Create firmware development roadmapLead the firmware development and validation processes so that a quality, well documented firmware is developed and delivered to Infineon's customerLead design reviews, and code reviews to identify the potential issues early in the development life cycleManage workload and expectations of the Enterprise Power (EP) firmware applications team and set priorities as neededFirmware/GUI development and verification utilizing C language and JavascriptFirmware/GUI testing and validation with  multiphase voltage regulators and updates as neededContribute new ideas to firmware/GUI development and write proposals for new featuresCreate documentation of firmware/GUI designs for controller products through feature definition, user guides and white papersProvide customer support:Support customer firmware usage issues such as installation, various computer configurations, tool usage on customer I2C bus, USB issues, etc.Provide firmware/GUI training to FAEs, sales, and customers as neededTest power supply products firmware with customer applicationReview similar industry products firmware/GUI to make sure Infineon has the best featuresTravel occasionally (Approximately 10% of the time) to provide on-site customer supportYou have hands-on experience in writing firmware and software utilizing C programming language. You enjoy working in the lab to validate the Voltage Regulator firmware and corresponding GUI software to deliver improvements per customer requirements. The ability to test and debug existing firmware/software code, as well as to write new code is the key part of the job responsibilities.You are best equipped for this task if you have:BS Computer Science or MSCS preferred. Studies in Electrical Engineering (EE) required.Minimum of 6-10 years of experiencein writing firmware code in a corporate setting, including leading projects and teamsProgramming experience in C language is required. Visual Basic (VB) programming is desiredLab skills to debug firmware/GUI software with hardware circuitsAre extremely responsive, ready to jump on the most difficult design and/or customer issues instantlyGood at developing relationships with internal and external engineering communityAbility to effectively multi-task, manage priorities and solve technical problems independentlyAre self-learning, self-disciplined, and a good team playerGood communication skills in both verbal and written EnglishAre highly motivated, energetic and enthusiasticAdditional/Desirable Skills:DC/DC or similar power solutionsVersion control systems such as GitDebugger proficiency using a Lauterbach trace32 or similar debuggerProgramming with PythonCommunication protocols like I2C/PMBus/SPI, etc.Bug tracking system such as JIRAAutomated firmware/software testing toolsKnowledge of UI/UX design and user-friendly control flow~Infineon Power & Sensor Systems (PSS) semiconductors play a vital role in enabling intelligent power management, smart sensitivity as well as fast and reliable data processing in an increasingly digitalized world.Our leading-edge power devices make chargers, adapters, power tools and lighting systems smarter, smaller, lighter and more energy-efficient. Our trusted sensors increase the context sensitivity of ""things"" and systems such as HMI, and our RF chips power fast and reliable data communication.- We drive leading-edge power management, sensing and data transfer capabilities -"||https://job-openings.monster.com/software-engineer-lead-technical-manager-andover-ma-us-infineon-technologies-americas-corp/219100115|219100115|monster|Python
new|Software Test Engineer|Assurance Technology Corporation|Carlisle, MA|2020-07-15|ATC is looking for experienced Test Software Engineers to define and implementing test system architectures, software applications, and algorithms for advanced digital and RF systems.Qualifications:Bachelors Degree (or higher) in Computer Science or related field and 7+ years of working experienceMethodical design, testing, and troubleshooting capabilitiesPython and/or C/C++ experienceAbility to manage multiple deadlines and shift priorities successfullyStrong communication and writing skillsMust have or be eligible for USG security clearanceResponsibilities:Develop test architectures that fully validate embedded systems per a given set of requirementsWork with cross-functional engineering development team to implement test architecturesCompile design documentation including block diagrams, drawings, reports, and notesTrain ATC staff members to use test systems.Interested candidates submit resumes to jobs@assurtech.comAssurance Technology Corporation (ATC) is a leader in the design and development of high technology electronics systems for the space and communications industries.ATC has a successful history in space and ground systems research and development programs yielding advanced technology high reliabilityhardwareand software as well as providing engineering and management consulting and high reliability test services. ATC offers excellent benefits including company paid medical and dental insurance, a deferred profit sharing plan, and a 401(k) savings plan. Our Massachusetts facilities are located northwest of Boston convenient to routes 2, 3, 128, and 495. Visit our website at http://www.assurtech.com.Assurance Technology Corporation is an Equal Opportunity Employer to include Veterans and individuals with disabilities.||https://job-openings.monster.com/software-test-engineer-carlisle-ma-us-assurance-technology-corporation/214029973|214029973|monster|Python
